qid,label,enwiki_title,domain,p31_classes,p31_qids,p910_categories,p910_count,wikipedia_categories,p31_count,category_count,p279_depth,wp_depth,p910_depth,p910_matched_category,overlap_count,matched_categories,overlap_ratio
Q11043,Wiehl,Wiehl,cities,city|urban municipality in Germany|medium-sized district town,Q515|Q42744322|Q54935786,Cities,1,Oberbergischer Kreis|Towns in North Rhine-Westphalia,3,2,0,2,2,Cities,0,,0.0
Q2683,Parma,Parma,cities,city|comune of Italy|big city|medieval commune,Q515|Q747074|Q1549591|Q5107861,Cities|Municipalities of Italy,2,Cities and towns in Emilia-Romagna|Municipalities of the Province of Parma|Parma,4,3,0,2,2,Cities,0,,0.0
Q4133,Nordhorn,Nordhorn,cities,city|district capital|border city|independent community|urban municipality in Germany|Einheitsgemeinde of Lower Saxony,Q515|Q134626|Q902814|Q2267870|Q42744322|Q133997300,Cities,1,1370s establishments in the Holy Roman Empire|1379 establishments in Europe|County of Bentheim (district)|Germany–Netherlands border crossings|Towns in Lower Saxony,6,5,0,2,2,Cities,0,,0.0
Q4301,Arusha,Arusha,cities,city|big city,Q515|Q1549591,Cities,1,1900 establishments in German East Africa|Arusha|Cities in Tanzania|Populated places in Arusha Region|Regional capitals in Tanzania,2,5,0,2,2,Cities,0,,0.0
Q18774,Kuçovë,Ku%C3%A7ov%C3%AB,cities,city,Q515,Cities,1,Administrative units of Kuçovë|Closed cities|De-Stalinization|Kuçovë|Municipalities in Berat County|Populated places established in 2015,1,6,0,2,2,Cities,0,,0.0
Q18772,Librazhd,Librazhd,cities,city,Q515,Cities,1,Administrative units of Librazhd|Librazhd|Municipalities in Elbasan County|Towns in Albania,1,4,0,2,2,Cities,0,,0.0
Q11194,Sarajevo,Sarajevo,cities,city|federal capital|big city|city of Bosnia and Herzegovina,Q515|Q257391|Q1549591|Q102104752,Cities,1,1461 establishments in Europe|1984 Winter Olympics|Bosnia and Herzegovina education-related lists|Capital cities in Europe|Lists of buildings and structures in Bosnia and Herzegovina|Lists of tourist attractions in Bosnia and Herzegovina|Museums in Bosnia and Herzegovina|National Monuments of Bosnia and Herzegovina|Populated places established in the 1460s|Populated places in the Sarajevo Canton|Sarajevo|World Heritage Tentative List for Bosnia and Herzegovina,4,12,0,2,2,Cities,0,,0.0
Q2704,Pescara,Pescara,cities,city|comune of Italy,Q515|Q747074,Cities|Municipalities of Italy,2,Cities and towns in Abruzzo|Coastal towns in Abruzzo|Mediterranean port cities and towns in Italy|Municipalities of the Province of Pescara|Pescara|Port cities and towns of the Adriatic Sea,2,6,0,2,2,Cities,0,,0.0
Q174,São Paulo,S%C3%A3o_Paulo,cities,city|megacity|big city|municipality of Brazil|largest city,Q515|Q174844|Q1549591|Q3184121|Q51929311,Cities|Municipalities of Brazil,2,1554 establishments in the Portuguese Empire|Municipalities in São Paulo (state)|Populated places established in 1554|State capitals in Brazil|São Paulo (city),5,5,0,1,1,Municipalities of Brazil,0,,0.0
Q18793,Ersekë,Ersek%C3%AB,cities,city|human settlement|rural settlement,Q515|Q486972|Q129676371,Cities|Human settlement,2,Administrative units of Kolonjë|Former municipalities in Korçë County|Towns in Albania,3,3,0,2,2,Cities,0,,0.0
